{
  "formId": "f1040",
  "formTitle": "Form 1040 (2025) - U.S. Individual Income Tax Return",
  "taxYear": 2025,
  "revision": "2025-rev-1",
  "sourcePdf": {
    "fileName": "f1040.pdf",
    "sha256": "3d31c226df0d189ced80e039d01cf0f8820c1019681a0f0ca6264de277b7e982",
    "pageCount": 2,
    "pageSize": { "width": 612, "height": 792 }
  },
  "coordinateSystem": "pdf-points-top-left",
  "fields": [
    { "id": "f1040.name.firstMi", "label": "Your first name and middle initial", "box": { "page": 1, "x": 36, "y": 96, "width": 215, "height": 12 },
      "type": "text", "required": true, "align": "left",
      "value": { "path": "$.taxpayer.firstName" }, "format": { "kind": "text" }, "overflow": "shrink" },
    { "id": "f1040.name.last", "label": "Last name", "box": { "page": 1, "x": 256, "y": 96, "width": 210, "height": 12 },
      "type": "text", "required": true, "align": "left",
      "value": { "path": "$.taxpayer.lastName" }, "format": { "kind": "text" }, "overflow": "shrink" },
    { "id": "f1040.ssn.you", "label": "Your social security number", "box": { "page": 1, "x": 472, "y": 96, "width": 104, "height": 12 },
      "type": "ssn", "required": true, "align": "center",
      "value": { "path": "$.taxpayer.ssn" }, "format": { "kind": "ssn-mask", "maskPattern": "###-##-####" }, "overflow": "error" },

    { "id": "f1040.spouse.name.firstMi", "label": "If joint return, spouse's first name and middle initial", "box": { "page": 1, "x": 36, "y": 120, "width": 215, "height": 12 },
      "type": "text", "align": "left",
      "value": { "path": "$.spouse.firstName", "default": "" }, "format": { "kind": "text" }, "overflow": "shrink" },
    { "id": "f1040.spouse.name.last", "label": "Spouse last name", "box": { "page": 1, "x": 256, "y": 120, "width": 210, "height": 12 },
      "type": "text", "align": "left",
      "value": { "path": "$.spouse.lastName", "default": "" }, "format": { "kind": "text" }, "overflow": "shrink" },
    { "id": "f1040.ssn.spouse", "label": "Spouse's social security number", "box": { "page": 1, "x": 472, "y": 120, "width": 104, "height": 12 },
      "type": "ssn", "align": "center",
      "value": { "path": "$.spouse.ssn", "default": "" }, "format": { "kind": "ssn-mask", "maskPattern": "###-##-####" }, "overflow": "error" },

    { "id": "f1040.address.street", "label": "Home address (number and street)", "box": { "page": 1, "x": 36, "y": 144, "width": 380, "height": 12 },
      "type": "text", "required": true, "align": "left",
      "value": { "path": "$.address.street" }, "format": { "kind": "text" }, "overflow": "shrink" },
    { "id": "f1040.address.apt", "label": "Apt. no.", "box": { "page": 1, "x": 421, "y": 144, "width": 45, "height": 12 },
      "type": "text", "align": "left",
      "value": { "path": "$.address.aptNo", "default": "" }, "format": { "kind": "text" }, "overflow": "truncate" },
    { "id": "f1040.address.city", "label": "City, town, or post office", "box": { "page": 1, "x": 36, "y": 168, "width": 295, "height": 12 },
      "type": "text", "required": true, "align": "left",
      "value": { "path": "$.address.city" }, "format": { "kind": "text" }, "overflow": "shrink" },
    { "id": "f1040.address.state", "label": "State", "box": { "page": 1, "x": 335, "y": 168, "width": 60, "height": 12 },
      "type": "text", "required": true, "align": "left",
      "value": { "path": "$.address.state" }, "format": { "kind": "text" }, "overflow": "error" },
    { "id": "f1040.address.zip", "label": "ZIP code", "box": { "page": 1, "x": 400, "y": 168, "width": 70, "height": 12 },
      "type": "text", "required": true, "align": "left",
      "value": { "path": "$.address.zip" }, "format": { "kind": "text" }, "overflow": "error" },

    { "id": "f1040.filingStatus", "label": "Filing Status - Check only one box", "box": { "page": 1, "x": 36, "y": 206, "width": 460, "height": 36 },
      "type": "radio-group", "required": true,
      "value": { "path": "$.filingStatus" },
      "options": [
        { "id": "single", "box": { "page": 1, "x": 99, "y": 208, "width": 10, "height": 10 }, "matchValue": "single" },
        { "id": "marriedFilingJointly", "box": { "page": 1, "x": 99, "y": 220, "width": 10, "height": 10 }, "matchValue": "marriedFilingJointly" },
        { "id": "marriedFilingSeparately", "box": { "page": 1, "x": 99, "y": 232, "width": 10, "height": 10 }, "matchValue": "marriedFilingSeparately" },
        { "id": "headOfHousehold", "box": { "page": 1, "x": 351, "y": 208, "width": 10, "height": 10 }, "matchValue": "headOfHousehold" },
        { "id": "qualifyingSurvivingSpouse", "box": { "page": 1, "x": 351, "y": 220, "width": 10, "height": 10 }, "matchValue": "qualifyingSurvivingSpouse" }
      ]
    },

    { "id": "f1040.digitalAssets.yes", "label": "Digital Assets - Yes", "box": { "page": 1, "x": 519, "y": 287, "width": 10, "height": 10 },
      "type": "checkbox", "required": true, "align": "center",
      "value": { "path": "$.digitalAssets" }, "format": { "kind": "none", "trueText": "X", "falseText": "" }, "overflow": "error" },
    { "id": "f1040.digitalAssets.no", "label": "Digital Assets - No", "box": { "page": 1, "x": 555, "y": 287, "width": 10, "height": 10 },
      "type": "checkbox", "required": true, "align": "center",
      "value": { "path": "$.digitalAssets" }, "format": { "kind": "none", "trueText": "", "falseText": "X" }, "overflow": "error" },

    {
      "id": "f1040.dependents",
      "label": "Dependents",
      "box": { "page": 1, "x": 145, "y": 310, "width": 432, "height": 110 },
      "type": "table",
      "axis": "columns",
      "itemsPath": "$.dependents",
      "maxInstances": 4,
      "pitch": { "dx": 108, "dy": 0 },
      "columns": [
        { "id": "f1040.dep.firstName", "label": "Dependent first name", "box": { "page": 1, "x": 145, "y": 312, "width": 90, "height": 10 },
          "type": "text", "align": "left", "value": { "path": "$.firstName" }, "format": { "kind": "text" }, "overflow": "shrink" },
        { "id": "f1040.dep.lastName", "label": "Dependent last name", "box": { "page": 1, "x": 145, "y": 324, "width": 90, "height": 10 },
          "type": "text", "align": "left", "value": { "path": "$.lastName" }, "format": { "kind": "text" }, "overflow": "shrink" },
        { "id": "f1040.dep.ssn", "label": "Dependent SSN", "box": { "page": 1, "x": 145, "y": 336, "width": 90, "height": 10 },
          "type": "ssn", "align": "center", "value": { "path": "$.ssn" }, "format": { "kind": "ssn-mask", "maskPattern": "###-##-####" }, "overflow": "error" },
        { "id": "f1040.dep.relationship", "label": "Relationship", "box": { "page": 1, "x": 145, "y": 348, "width": 90, "height": 10 },
          "type": "text", "align": "left", "value": { "path": "$.relationship" }, "format": { "kind": "text" }, "overflow": "shrink" },
        { "id": "f1040.dep.livedWithYou", "label": "Check if lived with you more than half of 2025", "box": { "page": 1, "x": 180, "y": 360, "width": 10, "height": 10 },
          "type": "checkbox", "align": "center", "value": { "path": "$.livedWithYou" }, "format": { "kind": "none", "trueText": "X", "falseText": "" }, "overflow": "error" },
        { "id": "f1040.dep.fullTimeStudent", "label": "Check if full-time student", "box": { "page": 1, "x": 159, "y": 381, "width": 10, "height": 10 },
          "type": "checkbox", "align": "center", "value": { "path": "$.fullTimeStudent" }, "format": { "kind": "none", "trueText": "X", "falseText": "" }, "overflow": "error" },
        { "id": "f1040.dep.ctc", "label": "Check if Child tax credit", "box": { "page": 1, "x": 159, "y": 403, "width": 10, "height": 10 },
          "type": "checkbox", "align": "center", "value": { "path": "$.childTaxCredit" }, "format": { "kind": "none", "trueText": "X", "falseText": "" }, "overflow": "error" },
        { "id": "f1040.dep.codo", "label": "Check if Credit for other dependents", "box": { "page": 1, "x": 210, "y": 403, "width": 10, "height": 10 },
          "type": "checkbox", "align": "center", "value": { "path": "$.creditForOtherDependents" }, "format": { "kind": "none", "trueText": "X", "falseText": "" }, "overflow": "error" }
      ]
    },

    { "id": "f1040.line1a", "label": "1a  Total amount from Form(s) W-2, box 1", "box": { "page": 1, "x": 488, "y": 452, "width": 90, "height": 10 },
      "type": "currency", "required": true,
      "value": { "path": "$.income.w2[*].box1Wages", "aggregate": "sum" },
      "format": { "kind": "currency", "decimalPlaces": 0, "roundingMode": "half-up", "negativeStyle": "parens" }, "overflow": "shrink" },
    { "id": "f1040.line1z", "label": "1z  Add lines 1a through 1h", "box": { "page": 1, "x": 488, "y": 560, "width": 90, "height": 10 },
      "type": "currency", "required": true,
      "value": { "path": "$.income.w2[*].box1Wages", "aggregate": "sum" },
      "format": { "kind": "currency", "decimalPlaces": 0, "roundingMode": "half-up", "negativeStyle": "parens" }, "overflow": "shrink" },

    { "id": "f1040.line2b", "label": "2b  Taxable interest", "box": { "page": 1, "x": 488, "y": 572, "width": 90, "height": 10 },
      "type": "currency", "required": true,
      "value": { "path": "$.income.taxableInterest" },
      "format": { "kind": "currency", "decimalPlaces": 0, "roundingMode": "half-up", "negativeStyle": "parens" }, "overflow": "shrink" },
    { "id": "f1040.line3b", "label": "3b  Ordinary dividends", "box": { "page": 1, "x": 488, "y": 584, "width": 90, "height": 10 },
      "type": "currency", "required": true,
      "value": { "path": "$.income.ordinaryDividends" },
      "format": { "kind": "currency", "decimalPlaces": 0, "roundingMode": "half-up", "negativeStyle": "parens" }, "overflow": "shrink" },
    { "id": "f1040.line4b", "label": "4b  IRA distributions, taxable amount", "box": { "page": 1, "x": 488, "y": 608, "width": 90, "height": 10 },
      "type": "currency",
      "value": { "path": "$.income.iraDistributionsTaxable", "default": 0 },